{
  "$schema": "http://json-schema.org/draft-07/schema#",
  "$id": "execution.schema.json",
  "title": "Execution Record",
  "description": "One attempt to run something. Created BEFORE the run starts (status RUNNING is expressed as PARTIAL) and finalised after, so an interrupted run leaves a trace.",
  "type": "object",
  "required": ["execution_id", "session_id", "started_at", "goal", "method", "status", "provenance"],
  "properties": {
    "execution_id": { "$ref": "common.schema.json#/definitions/executionId" },
    "session_id": { "$ref": "common.schema.json#/definitions/sessionId" },
    "decision_id": { "$ref": "common.schema.json#/definitions/decisionId" },
    "plan_id": { "$ref": "common.schema.json#/definitions/planId" },
    "reproduces": { "$ref": "common.schema.json#/definitions/findingId", "description": "The finding this execution is a repro check for. A finding is confirmed only by a linked run that FAILED on a product-defect assertion with real evidence; a linked run that PASSED refutes it." },
    "test_files": { "type": "array", "items": { "type": "string" }, "description": "Test files this execution ran (repository-relative). How a test file written during the session is matched to the run that executed it; a written test with no run is a draft, and validate --final fails on it." },
    "plan_scenario_id": { "type": "string", "description": "Id of the scenario in the persisted plan that this execution fulfils. Links the execution back to a must-test/should-test scenario so the scenario coverage floor can confirm every planned scenario was addressed." },
    "started_at": { "$ref": "common.schema.json#/definitions/timestamp" },
    "finished_at": { "$ref": "common.schema.json#/definitions/timestamp" },
    "duration_ms": { "type": "integer", "minimum": 0, "description": "Deprecated alias for wall_clock_ms, kept for records written before that field existed. New code should read wall_clock_ms." },
    "wall_clock_ms": { "type": "integer", "minimum": 0, "description": "finished_at minus started_at: the full gap between the two CLI calls, including everything the agent did in between. NOT the runtime of whatever was tested -- see command_duration_ms for that." },
    "command_duration_ms": { "type": "integer", "minimum": 0, "description": "Sum of command.duration_ms across this execution's linked evidence -- the actual measured runtime of what was tested, when at least one item was captured via `evidence capture`. Absent, not zero, when no linked evidence recorded a real command duration." },
    "git": { "$ref": "common.schema.json#/definitions/gitRef" },
    "goal": { "type": "string", "minLength": 3 },
    "test_category": { "$ref": "common.schema.json#/definitions/testCategory" },
    "feature": { "type": "string", "description": "Id of the functionality_inventory item this execution exercises. Lets the per-feature coverage floor confirm every critical feature was addressed." },
    "method": {
      "type": "string",
      "enum": [
        "existing-suite", "generated-script", "playwright-script", "playwright-mcp",
        "browser-agent", "static-analysis", "manual-review", "api-client",
        "load-tool", "scanner", "database-query", "hybrid", "not-executed"
      ],
      "description": "'not-executed' is legitimate and must be used when the record exists only to document a BLOCKED/SKIPPED item."
    },
    "command": { "type": "string", "description": "Exact command line, redacted." },
    "cwd": { "type": "string" },
    "environment": { "type": "string", "description": "Named environment, e.g. 'local-docker', 'staging'." },
    "runtime": {
      "type": "object",
      "description": "Where the CLI ran when the execution opened. Captured automatically; two runs of the same command at the same commit on different runtimes are not the same result.",
      "properties": {
        "os": { "type": "string" },
        "arch": { "type": "string" },
        "node": { "type": "string" }
      },
      "additionalProperties": false
    },
    "target": {
      "type": "object",
      "description": "A deployed system tested over the network. Its code is whatever was deployed, which the local git commit does not identify.",
      "required": ["url"],
      "properties": {
        "url": { "type": "string", "minLength": 1 },
        "deployed_commit": { "type": "string", "description": "The commit the deployment was built from, if known (e.g. from the hosting dashboard). Absent means unknown." }
      },
      "additionalProperties": false
    },
    "status": { "$ref": "common.schema.json#/definitions/status" },
    "status_reason": { "type": "string" },
    "test_results": {
      "type": "array",
      "items": { "$ref": "test-result.schema.json" }
    },
    "totals": {
      "type": "object",
      "properties": {
        "total": { "type": "integer", "minimum": 0 },
        "passed": { "type": "integer", "minimum": 0 },
        "failed": { "type": "integer", "minimum": 0 },
        "skipped": { "type": "integer", "minimum": 0 },
        "errored": { "type": "integer", "minimum": 0 }
      },
      "additionalProperties": false
    },
    "evidence": { "$ref": "common.schema.json#/definitions/evidenceRefs" },
    "findings": {
      "type": "array",
      "items": { "$ref": "common.schema.json#/definitions/findingId" }
    },
    "uncertainties": {
      "type": "array",
      "items": { "$ref": "common.schema.json#/definitions/uncertaintyId" }
    },
    "failure_classification": {
      "type": "object",
      "properties": {
        "class": {
          "type": "string",
          "enum": [
            "product-defect", "test-defect", "environment-defect", "infrastructure-failure",
            "dependency-failure", "flaky-test", "configuration-failure", "data-failure",
            "authentication-failure", "timeout", "performance-degradation",
            "expected-behaviour-mismatch", "ambiguous-requirement", "unclassified-no-signals",
            "unclassified"
          ]
        },
        "confidence": { "$ref": "common.schema.json#/definitions/confidence" },
        "signals": { "type": "array", "items": { "type": "string" } },
        "evidence_refs": { "$ref": "common.schema.json#/definitions/evidenceRefs" }
      },
      "required": ["class", "confidence"],
      "additionalProperties": false
    },
    "retries": { "type": "integer", "minimum": 0 },
    "next_action": { "type": "string" },
    "provenance": { "$ref": "common.schema.json#/definitions/provenance" }
  },
  "additionalProperties": false
}
