{
  "execution_id": "EXEC-2026-00003",
  "session_id": "SESSION-0001",
  "started_at": "2026-10-12T11:19:59.025Z",
  "goal": "User A cannot select user B's saved card",
  "method": "api-client",
  "status": "FAILED",
  "status_reason": "GET /api/payment-methods/:id returned another user's card with HTTP 200.",
  "evidence": [
    "EV-2026-00002"
  ],
  "findings": [
    "FIND-00001"
  ],
  "uncertainties": [],
  "retries": 0,
  "provenance": {
    "skill_version": "0.13.0",
    "skill_name": "testing-orchestrator",
    "engine_version": "0.13.0",
    "created_at": "2026-10-12T11:19:59.025Z",
    "created_by": "agent",
    "session_id": "SESSION-0001"
  },
  "test_category": "authn-authz",
  "decision_id": "DEC-00001",
  "plan_scenario_id": "S-02",
  "command": "npm run test:api -- saved-cards",
  "environment": "local-docker",
  "runtime": {
    "os": "win32 10.0.26300",
    "arch": "x64",
    "node": "v22.17.1"
  },
  "git": {
    "repository": "acme/shop",
    "branch": "feat/SHOP-412-saved-card",
    "commit": "abc1234",
    "pull_request": "412",
    "dirty": false
  },
  "finished_at": "2026-10-12T11:19:59.037Z",
  "wall_clock_ms": 12,
  "duration_ms": 12,
  "command_duration_ms": 3120,
  "test_results": [
    {
      "name": "saved card belonging to another user is not selectable",
      "status": "FAILED",
      "file": "test/api/saved-cards.test.ts",
      "validates_requirements": [
        "REQ-3"
      ]
    }
  ],
  "totals": {
    "total": 1,
    "passed": 0,
    "failed": 1,
    "skipped": 0,
    "errored": 0
  },
  "failure_classification": {
    "class": "product-defect",
    "confidence": 0.59,
    "signals": [
      "assertion-mismatch"
    ],
    "evidence_refs": [
      "EV-2026-00002"
    ]
  }
}
